{
  "id": "01jrcasebox00000000000cx01",
  "tenant_id": "tenant-local-v1",
  "actor_user_id": "local-user",
  "matter_id": "01jrcasebox0000000000000m1",
  "claim_track_id": "01jrcasebox0000000000000t1",
  "evidence_id": "01jrcasebox0000000000000e1",
  "direction": "our_objection_to_their_evidence",
  "authenticity_status": "denied",
  "authenticity_reason": "The signature block does not match the counterparty's filed exemplar.",
  "legality_status": "conditional",
  "legality_reason": "Chain of custody is incomplete for the scanned copy.",
  "relevance_status": "admitted",
  "relevance_reason": "Concedes relevance to the delivery-date dispute.",
  "probative_force_status": "reserved",
  "probative_force_reason": "Weight reserved pending the authenticity ruling.",
  "overall_opinion": "Object to authenticity; press for the original.",
  "courtroom_short_version": "Authenticity challenged — demand the original.",
  "our_response_short_version": null,
  "preparation_status": "ready_for_trial",
  "created_at": "2026-07-16T10:00:00.000Z",
  "updated_at": "2026-07-16T10:00:00.000Z"
}
